text,summary,text_trunc,abs_summary,ext_summary
"Vowing to cling on: Liberal Democrats leader Nick Clegg makes a speech during a General Election campaign visit to Sutton in south London yesterday . Nick Clegg yesterday vowed to cling on as Liberal Democrat leader even if the party is wiped out at the polls. Friends of the Deputy Prime Minister have previously indicated that he will quit as leader if the Lib Dems are reduced to fewer than 30 MPs, while sources have also suggested he will go if the party is left out of power after the election. But yesterday he insisted he would fight for his job ‘in all circumstances’. He told Sky News: ‘I’m really optimistic about the prospects of Liberal Democrats. 'Of course I want to continue to serve the country and serve my party, which I am so proud to have served for seven or eight years now.’ He added: ‘I want to lead the Liberal Democrats into and through the next Parliament in all circumstances. ‘All I am focused on at the moment is sounding the alarm about the very, very real risk that as the Labour Party and Conservative Party vacate the centre ground and hare off in which direction after another, there is a very real risk we undo all the sacrifices and hard work that have gone in over the last five years to put the country back on track economically.’ Meet and greet: Mr Clegg (far right) speaks to voters and their families during a General Election campaign visit to Sutton with Paul Burstow (second right) the party's candidate for Sutton and Cheam . His comments came as Business Secretary Vince Cable said he hoped to be made Chancellor if the Lib Dems form another coalition with the Conservatives. Mr Clegg also appeared to lean towards another deal with the Tories, saying he deserved ‘credit’ for forming the Coalition while he had endured ‘five years of constant bile from the Labour Party, who condemned us vitriolically for taking decisions which we only had to take because we had to clear up the mess they left behind’.","Sources claimed he'd go if Lib Dems are reduced to fewer than 30 MPs .
But yesterday insisted he would fight for his job 'in all circumstances'
Warned of 'very real risk we undo all the hard work over last five years'
Vince Cable hopes to be Chancellor if Lib Dems form another coalition .","Vowing to cling on: Liberal Democrats leader Nick Clegg makes a speech during a General Election campaign visit to Sutton in south London yesterday . Nick Clegg yesterday vowed to cling on as Liberal Democrat leader even if the party is wiped out at the polls. Friends of the Deputy Prime Minister have previously indicated that he will quit as leader if the Lib Dems are reduced to fewer than 30 MPs, while sources have also suggested he will go if the party is left out of power after the election. But yesterday he insisted he would fight for his job ‘in all circumstances’. He told Sky News: ‘I’m really optimistic about the prospects of Liberal Democrats. 'Of course I want to continue to serve the country and serve my party, which I am so proud to have served for seven or eight years now.’ He added: ‘I want to lead the Liberal Democrats into and through the next Parliament in all circumstances. ‘All I am focused on at the moment is sounding the alarm about the very, very real risk that as the Labour Party and Conservative Party vacate the centre ground and hare off in which direction after another, there is a very real risk we undo all the sacrifices and hard work that have gone in over the last five years to put the country back on track economically.’ Meet and greet: Mr Clegg (far right) speaks to voters and their families during a General Election campaign visit to Sutton with Paul Burstow (second right) the party's candidate for Sutton and Cheam . His comments came as Business Secretary Vince Cable said he hoped to be made Chancellor if the Lib Dems form another coalition with the Conservatives. Mr Clegg also appeared to lean towards another deal with the Tories, saying he deserved ‘credit’ for forming the Coalition while he had endured ‘five years of constant bile from the Labour Party, who condemned us vitriolically for taking decisions which we only had to take because we had to clear up the mess they left behind’.",Deputy Prime Minister insists he will fight for his job 'in all circumstances' Friends of Mr Clegg have previously indicated he will quit as leader if the Lib Dems are reduced to fewer than 30 MPs. Vince Cable said he hoped to be made Chancellor if Lib Dems form another coalition with the Conservatives.,"Vowing to cling on: Liberal Democrats leader Nick Clegg makes a speech during a General Election campaign visit to Sutton in south London yesterday . Nick Clegg yesterday vowed to cling on as Liberal Democrat leader even if the party is wiped out at the polls. Friends of the Deputy Prime Minister have previously indicated that he will quit as leader if the Lib Dems are reduced to fewer than 30 MPs, while sources have also suggested he will go if the party is left out of power after the election."
"Paul Gregory, 51, of Bedford, has been fined £795 for having a blue badge, claiming he could only walk 200 metres, when in fact he was a keen walker . A disability badge holder who claimed he could only walk 200 metres ended up in court after council officials noticed a newspaper report recounting his exploits on a 191-mile hike. When Paul Gregory, 51, applied to renew his blue badge, he claimed exercise left him breathless, despite being a keen walker and member of a mountaineering club. He was exposed when Bedford Borough Council staff read an article in The Westmorland Gazette,  describing how the 'experienced walker' had been attacked by cows in Cumbria on the third day of a hike in 2012. The article, which featured a picture of him dressed in walking gear, told how he was knocked over by four cows in a field at the edge of Shap in Cumbria. The council also found he had spent a weekend walking in Wales days before making a blue badge application. Gregory, of Bedford, pleaded guilty to two counts of dishonestly obtaining a blue badge by misrepresenting his physical abilities at Luton Magistrates' Court. He was fined £795, ordered to carry out 150 hours of unpaid work and pay a £60 victim surcharge. He was also subject to a one year supervision order and told to undergo 19 sessions of 'thinking skills'. A Bedford Borough Council spokesman said it was one of the 'most outrageous cases' of blue badge fraud it had investigated. He said: 'He was taking part in national walking trips that many able-bodied adults would find difficult. 'Mr Gregory's abuse of the scheme is completely unacceptable and we will continue to investigate all reports of blue badge fraud thoroughly.' Gregory was fined £795 and ordered to carry out 150 hours of unpaid work when he admitted dishonestly obtaining a blue badge by misrepresenting his physical abilities at Luton Magistrates' Court (pictured)","Paul Gregory said he could only walk 200 metres in blue badge application .
However, council staff noticed 51-year-old in newspaper report after hike .
Article described Gregory as an 'experienced walker' on a three-day trek .
Gregory fined £795 after admitting to dishonestly obtaining a blue badge .","Paul Gregory, 51, of Bedford, has been fined £795 for having a blue badge, claiming he could only walk 200 metres, when in fact he was a keen walker . A disability badge holder who claimed he could only walk 200 metres ended up in court after council officials noticed a newspaper report recounting his exploits on a 191-mile hike. When Paul Gregory, 51, applied to renew his blue badge, he claimed exercise left him breathless, despite being a keen walker and member of a mountaineering club. He was exposed when Bedford Borough Council staff read an article in The Westmorland Gazette,  describing how the 'experienced walker' had been attacked by cows in Cumbria on the third day of a hike in 2012. The article, which featured a picture of him dressed in walking gear, told how he was knocked over by four cows in a field at the edge of Shap in Cumbria. The council also found he had spent a weekend walking in Wales days before making a blue badge application. Gregory, of Bedford, pleaded guilty to two counts of dishonestly obtaining a blue badge by misrepresenting his physical abilities at Luton Magistrates' Court. He was fined £795, ordered to carry out 150 hours of unpaid work and pay a £60 victim surcharge. He was also subject to a one year supervision order and told to undergo 19 sessions of 'thinking skills'. A Bedford Borough Council spokesman said it was one of the 'most outrageous cases' of blue badge fraud it had investigated. He said: 'He was taking part in national walking trips that many able-bodied adults would find difficult. 'Mr Gregory's abuse of the scheme is completely unacceptable and we will continue to investigate all reports of blue badge fraud thoroughly.' Gregory was fined £795 and ordered to carry out 150 hours of unpaid work when he admitted dishonestly obtaining a blue badge by misrepresenting his physical abilities at Luton Magistrates' Court (pictured)","Paul Gregory, 51, claimed exercise left him breathless, despite being a keen walker. Bedford Borough Council found he had been attacked by cows on 191-mile hike. He pleaded guilty to dishonestly obtaining a blue badge by misrepresenting his physical abilities. He was fined £795 and ordered to carry out 150 hours of unpaid work.","Paul Gregory, 51, of Bedford, has been fined £795 for having a blue badge, claiming he could only walk 200 metres, when in fact he was a keen walker . A disability badge holder who claimed he could only walk 200 metres ended up in court after council officials noticed a newspaper report recounting his exploits on a 191-mile hike. When Paul Gregory, 51, applied to renew his blue badge, he claimed exercise left him breathless, despite being a keen walker and member of a mountaineering club."
"Apple offers a range of ways to unlock its devices from PINs to passwords and fingerprints. But you could soon use a selfie to gain access to your apps and messages thanks to Apple's latest patent. The filing details a system of scanning a user's face with the front-facing camera when the handset is moved into a certain position, and automatically unlocking the device if the image matches one on file. The patent (illustrated) was filed by the California-based firm in March 2011 and awarded earlier this week. It details a method of scanning a user's face using the front-facing camera each time the phone is moved into a certain position. If the scanned face matches a previously taken photo, the phone unlocks automatically . The patent was filed by the Californian tech giant in March 2011 and awarded earlier this week. Called 'Locking and unlocking a mobile device using facial recognition', the patent explains that current methods of unlocking a device are 'inconvenient and time consuming'. Apple's patent details a method for automatically unlocking a mobile device using a system comprising of 'capturing an initial image  while the device is locked, monitoring a motion state of the mobile device to determine whether the device is moving or is motionless;  analysing the images to detect a user's face and unlocking the device.' Android Lollipop users already have an almost identical feature known as Trusted face in the Smart Lock menu. It is an extension of Face Unlock that launched on Android Ice Cream Sandwich. Once the screen is enabled and the camera is held in front of the face, the screen automatically unlocks. This relies on the user pressing the power button to enable the screen. By comparison it appears that Apple's proposed system would track the movement of the phone to determine whether it is being used, or is placed flat on a table. Apple, instead, provides a method for automatically unlocking a mobile device using a system comprising of 'capturing an initial image  while the device is locked, monitoring a motion state of the mobile device to determine whether the device is moving or is motionless;  analysing the images to detect a user's face and unlocking the device.' Android Lollipop users already have an almost identical feature known as 'Trusted face' in the Smart Lock menu. It is an extension of Face Unlock that launched on Android Ice Cream Sandwich. Once the screen is enabled and the camera is held in front of the face, the screen automatically unlocks. This relies on the user pressing the power button to enable the screen. By comparison, it appears that Apple's proposed system would track the movement of the phone to determine whether it is being used, or is placed flat on a table. The screen wouldn't need to be enabled. Instead, once the phone is moved and positioned in front of the face the camera would begin scanning. It will only unlock if the angle of the face matches, or is similar to, the one that was initially taken to avoid the phone unlocking simply when the phone is near a face. As Apple explained: 'In one embodiment, the image is analysed for a facial profile of a human face, without regard to a specific user. Apple's proposed system tracks the movement of the phone to determine whether it is being used, or is placed flat on a table (flow chart shown). The screen wouldn't need to be enabled. Instead, once the phone is moved and positioned in front of the face the camera would begin scanning for a face . Android Lollipop users already have an almost identical feature known as 'Trusted face' (left) in the Smart Lock menu. Once the screen is enabled and the camera is held in front of the face, the screen automatically unlocks. The face icon between the Whatsapp and Chrome logo (right) shows the feature is enabled . 'In this case, the device will only need to determine that a human facial profile is present.' It continued that once an allotted period of time has elapsed and a user's face is not detected in any of the images, the device stays locked. 'In another embodiment, detecting the user's face may also include verifying that the user is an authorised user of the device,' the files continued. 'Trusted face' and Smart Lock are extensions of the Face Unlock feature that was launched on Android Ice Cream Sandwich (pictured). This relies on the user pressing the power button to enable the screen . 'The predetermined facial profile may be determined from an image that was previously captured by the device's camera and stored in a storage of images of authorised users.' Chip maker Qualcomm has unveiled its Sense ID 3D fingerprint scanner - the first biometric sensor using ultrasonic technology. It uses ultrasonic sound waves to capture the ridges, sweat pores and more on the tip of a finger in greater detail than capacitive touch ID sensors seen on the likes of Apple and Samsung devices. This not only makes it more accurate than other sensors, but it will also work even if the user’s hands are wet or have dirt or lotions on it, for example. Phones running Sense ID are expected to launch later this year, but Qualcomm did not reveal to MailOnline which devices or manufacturers it is working with. The patent also suggests this feature could be used by multiple users, in the way that multiple fingerprints can be added to its current Touch ID system. 'In this case, the database of images of authorised users would contain an image for each  user,' it added. 'To match a facial profile in the subsequent image, the device would have to compare the subsequent image to each image in the database. 'Furthermore, each authorised user may have an associated unlocking profile in the database that indicates what functions or applications of the device are enabled when the device is unlocked.' Phone makers are looking for alternative ways to secure devices while making them faster and more convenient to open. For example, Fujitsu recently demonstrated its iris scanning prototype that lets people access phones, apps and online accounts by staring at an infrared sensor. This would work in a similar way to facial recognition, but is more secure and unique to an individual user. Phone makers are looking for alternative ways to secure devices while making them faster and more convenient to open. For example, Fujitsu recently demonstrated its iris scanning prototype that lets people access phones, apps and online accounts by staring at an infrared sensor (illustrated)","The patent was filed in March 2011 and awarded to Apple earlier this week .
It details a method of scanning a user's face using the front-facing camera .
If the scanned face matches with a photo that was previously taken and stored, the phone unlocks automatically .
Android Lollipop already has a similar feature called 'Trusted face'","Apple offers a range of ways to unlock its devices from PINs to passwords and fingerprints. But you could soon use a selfie to gain access to your apps and messages thanks to Apple's latest patent. The filing details a system of scanning a user's face with the front-facing camera when the handset is moved into a certain position, and automatically unlocking the device if the image matches one on file. The patent (illustrated) was filed by the California-based firm in March 2011 and awarded earlier this week. It details a method of scanning a user's face using the front-facing camera each time the phone is moved into a certain position. If the scanned face matches a previously taken photo, the phone unlocks automatically . The patent was filed by the Californian tech giant in March 2011 and awarded earlier this week. Called 'Locking and unlocking a mobile device using facial recognition', the patent explains that current methods of unlocking a device are 'inconvenient and time consuming'. Apple's patent details a method for automatically unlocking a mobile device using a system comprising of 'capturing an initial image  while the device is locked, monitoring a motion state of the mobile device to determine whether the device is moving or is motionless;  analysing the images to detect a user's face and unlocking the device.' Android Lollipop users already have an almost identical feature known as Trusted face in the Smart Lock menu. It is an extension of Face Unlock that launched on Android Ice Cream Sandwich. Once the screen is enabled and the camera is held in front of the face, the screen automatically unlocks. This relies on the user pressing the power button to enable the screen. By comparison it appears that Apple's proposed system would track the movement of the phone to determine whether it is being used, or is placed flat on a table. Apple, instead, provides a method for automatically unlocking a mobile device using a system comprising of 'capturing an initial image  while the device is locked, monitoring a motion state of the mobile device to determine whether the device is moving or is motionless;  analysing the images to detect a user's face and unlocking the device.' Android Lollipop users already have an almost identical feature known as 'Trusted face' in the Smart Lock menu. It is an extension of Face Unlock that launched on Android Ice Cream Sandwich. Once the screen is enabled and the camera is held in front of the face, the screen automatically unlocks. This relies on the user pressing the power button to enable the screen. By comparison, it appears that Apple's proposed system would track the movement of the phone to determine whether it is being used, or is placed flat on a table. The screen wouldn't need to be enabled. Instead, once the phone is moved and positioned in front of the face the camera would begin scanning. It will only unlock if the angle of the face matches, or is similar to, the one that was initially taken to avoid the phone unlocking simply when the phone is near a face. As Apple explained: 'In one embodiment, the image is analysed for a facial profile of a human face, without regard to a specific user. Apple's proposed system tracks the movement of the phone to determine whether it is being used, or is placed flat on a table (flow chart shown). The screen wouldn't need to be enabled. Instead, once the phone is moved and positioned in front of the face the camera would begin scanning for a face . Android Lollipop users already have an almost identical feature known as 'Trusted face' (left) in the Smart Lock menu. Once the screen is enabled and the camera is held in front of the face, the screen automatically unlocks. The face icon between the Whatsapp and Chrome logo (right) shows the feature is enabled . 'In this case, the device will only need to determine that a human facial profile is present.' It continued that once an allotted period of time has elapsed and a user's face is not detected in any of the images, the device stays locked. 'In another embodiment, detecting the user's face may also include verifying that the user is an authorised user of the device,' the files continued. 'Trusted face' and Smart Lock are extensions of the Face Unlock feature that was launched on Android Ice Cream Sandwich (pictured). This relies on the user pressing the power button to enable the screen . 'The predetermined facial profile may be determined from an image that was previously captured b","The patent was filed by the California-based firm in March 2011. It details a method of scanning a user's face using the front-facing camera each time the phone is moved into a certain position. If the scanned face matches a previously taken photo, the phone unlocks automatically. Apple's proposed system would track the movement of the phone to determine whether it is being used, or is placed flat on a table. Android Lollipop users already have an almost identical feature known as 'Trusted face' in the Smart Lock menu.","Apple offers a range of ways to unlock its devices from PINs to passwords and fingerprints. But you could soon use a selfie to gain access to your apps and messages thanks to Apple's latest patent. The filing details a system of scanning a user's face with the front-facing camera when the handset is moved into a certain position, and automatically unlocking the device if the image matches one on file."
