text,summary,text_trunc,abs_summary,ext_summary
"Down Augusta way they say the azaleas are in full bloom, which is more than can be said for England’s Justin Rose. A bruising Florida swing last month saw the Englishman fall outside the world’s top 10. For a player who has been virtually a fixture in the top five for the last three years it was certainly a dent to the ego, with the Masters now just around the corner. Rose’s solution to his miserable form — three missed cuts and a 55th-place finish at the Cadillac Championship in four PGA Tour starts — was the time-honoured one. For the past two weeks, the 34-year-old has spent long hours on the practice ground. Justin Rose hit 17 out of 18 greens in regulation and signed for a 69 at the Shell Houston Open . In the first round of the Shell Houston Open on Thursday there were encouraging signs his decline will prove temporary. Rose hit 17 out of 18 greens in regulation and signed for a 69, the same score as his playing partner, the ever- consistent Jordan Spieth. ‘It’s certainly a welcome return to the sixties, for it had been a while,’ said Rose, smiling. On a day when American Scott Piercy went round in 63 and Phil Mickelson enjoyed his best round in months with a 66, it was hardly surprising the only reporter waiting to talk to Rose was this one. But under the radar is never a bad place to be going to the Masters. The boom and bust years that characterised the first half of Rose’s career meant there was never going to be any feelings of panic following his unusually poor run in the Sunshine State. ‘There’s no doubt I lost my game there but the Florida swing can be unforgiving if you’re slightly off,’ he said. ‘Over the past two weeks I feel like I’ve done some good work and whether I finish well or not here I feel like I’m going in the right direction again. ‘Basically I was getting ahead of the ball at impact, and shots were going left or right, the irons were not solid and the new putter was not working. So we’ve corrected the faults and I’ve gone back to the old putter.’ Phil Mickelson enjoyed his best round in months with a 66 on Thursday . Does he pay much attention to the world rankings? ‘You notice, for sure,’ he said. ‘I’m very proud of the fact I’ve been in the world’s top five for practically the whole of the last three years. It’s a nice ego thing, so by the end of the year I’m hoping there won’t be any slippage. ‘But right now, I’ve got to focus on my game in the knowledge that the rankings change fast when you’re playing well. I’m in all the tournaments I want to be in, so there’s no need to worry on that score. Typically, your good years are built around four or five really good weeks, so you have to stay patient.’ He’d certainly love for one of those good weeks to be the next one. Rose paid a reconnaissance visit to Augusta last Monday and felt the same old thrill. ‘It’s such a treat to enjoy it when it is quiet, you still pinch yourself,’ he said. ‘I think if I’d had a crystal ball when I was 13 or 14 and it had said I’d get to play Augusta every year, I’d have been very happy with that.’ He’s certainly had his share of adventures during his nine appearances to date. Rose might be the only player in Masters history to have led or had a share of the lead after every round bar the last one. His best chance so far of finishing on top after 72 holes came in 2007, when he stood on the 17th hole tied for the lead only to run up a fatal double-bogey six. Paul Casey celebrated his last-gasp Masters invitation with two eagle threes in a fine round of 68 . ‘The Masters has probably been less on my mind this year because I am trying to find some form,’ he admitted. ‘But I think the fact I’ve had a number of great rounds there will always stand me in good stead. Regardless of what happens here, I feel comfortable on that course and know I can manage my game even if it’s not 100 per cent. You draw off the energy of the place.’ Mickelson has certainly done that over the years and perhaps the veteran lefty, a three-time Masters champion, is gearing himself up for another run at the green jacket. ‘It was a good start to the tournament and now I’m looking for three more good rounds,’ he said. 'This is a big week for me. I felt the game was close last week. The only thing missing was chipping and short game.' Paul Casey, like Mickelson another former winner of this event, celebrated his last-gasp Masters invitation with a fine round of 68 notable for two eagle threes. In the afternoon wave, Padraig Harrington and Lee Westwood both made good starts to play their first six holes in two under.","Justin Rose bounced back from Florida misery by carding 69 in Houston .
Three-time Masters champion Phil Mickelson enjoyed return to form .
Paul Casey celebrated last-gasp Masters invitation with fine round of 68 .","Down Augusta way they say the azaleas are in full bloom, which is more than can be said for England’s Justin Rose. A bruising Florida swing last month saw the Englishman fall outside the world’s top 10. For a player who has been virtually a fixture in the top five for the last three years it was certainly a dent to the ego, with the Masters now just around the corner. Rose’s solution to his miserable form — three missed cuts and a 55th-place finish at the Cadillac Championship in four PGA Tour starts — was the time-honoured one. For the past two weeks, the 34-year-old has spent long hours on the practice ground. Justin Rose hit 17 out of 18 greens in regulation and signed for a 69 at the Shell Houston Open . In the first round of the Shell Houston Open on Thursday there were encouraging signs his decline will prove temporary. Rose hit 17 out of 18 greens in regulation and signed for a 69, the same score as his playing partner, the ever- consistent Jordan Spieth. ‘It’s certainly a welcome return to the sixties, for it had been a while,’ said Rose, smiling. On a day when American Scott Piercy went round in 63 and Phil Mickelson enjoyed his best round in months with a 66, it was hardly surprising the only reporter waiting to talk to Rose was this one. But under the radar is never a bad place to be going to the Masters. The boom and bust years that characterised the first half of Rose’s career meant there was never going to be any feelings of panic following his unusually poor run in the Sunshine State. ‘There’s no doubt I lost my game there but the Florida swing can be unforgiving if you’re slightly off,’ he said. ‘Over the past two weeks I feel like I’ve done some good work and whether I finish well or not here I feel like I’m going in the right direction again. ‘Basically I was getting ahead of the ball at impact, and shots were going left or right, the irons were not solid and the new putter was not working. So we’ve corrected the faults and I’ve gone back to the old putter.’ Phil Mickelson enjoyed his best round in months with a 66 on Thursday . Does he pay much attention to the world rankings? ‘You notice, for sure,’ he said. ‘I’m very proud of the fact I’ve been in the world’s top five for practically the whole of the last three years. It’s a nice ego thing, so by the end of the year I’m hoping there won’t be any slippage. ‘But right now, I’ve got to focus on my game in the knowledge that the rankings change fast when you’re playing well. I’m in all the tournaments I want to be in, so there’s no need to worry on that score. Typically, your good years are built around four or five really good weeks, so you have to stay patient.’ He’d certainly love for one of those good weeks to be the next one. Rose paid a reconnaissance visit to Augusta last Monday and felt the same old thrill. ‘It’s such a treat to enjoy it when it is quiet, you still pinch yourself,’ he said. ‘I think if I’d had a crystal ball when I was 13 or 14 and it had said I’d get to play Augusta every year, I’d have been very happy with that.’ He’s certainly had his share of adventures during his nine appearances to date. Rose might be the only player in Masters history to have led or had a share of the lead after every round bar the last one. His best chance so far of finishing on top after 72 holes came in 2007, when he stood on the 17th hole tied for the lead only to run up a fatal double-bogey six. Paul Casey celebrated his last-gasp Masters invitation with two eagle threes in a fine round of 68 . ‘The Masters has probably been less on my mind this year because I am trying to find some form,’ he admitted. ‘But I think the fact I’ve had a number of great rounds there will always stand me in good stead. Regardless of what happens here, I feel comfortable on that course and know I can manage my game even if it’s not 100 per cent. You draw off the energy of the place.’ Mickelson has certainly done that over the years and perhaps the veteran lefty, a three-time Masters champion, is gearing himself up for another run at the green jacket. ‘It was a good start to the tournament and now I’m looking for three more good rounds,’ he said. 'This is a big week for me. I felt the game was close last week. The only thing missing was chipping and short game.' Paul Casey, like Mickelson another former winner of this event, celebrated his last-gasp Masters invitation with a fine round of 68 notable for two eagle threes. In the afternoon wave, Padraig Harrington and Lee",Justin Rose hit 17 out of 18 greens in regulation and signed for a 69 at the Shell Houston Open on Thursday. The Englishman fell outside the world’s top 10 after a bruising Florida swing last month. Rose might be the only player in Masters history to have led or had a share of the lead after every round bar the last one.,"Down Augusta way they say the azaleas are in full bloom, which is more than can be said for England’s Justin Rose. A bruising Florida swing last month saw the Englishman fall outside the world’s top 10. For a player who has been virtually a fixture in the top five for the last three years it was certainly a dent to the ego, with the Masters now just around the corner."
"There was no special treatment for Lewis Ferguson at Paul Nicholls’ yard on Thursday morning. The 18-year-old was mucking out the stables as usual, just a cut on the nose to show for the fall which has made him an internet sensation. Ferguson, whose double somersault horror fall from the favourite Merrion Square in the 4.20pm at Wincanton on Wednesday has been watched hundreds of thousands of times online. But he was back riding out and said he was undeterred from getting back in the sadal. ‘It was just a blur,’ he said, ‘I couldn’t work out what had happened until I got back to the weighing room and watched the replay. All the other jockeys asked me if I was alright and stuff, they all watched with me and looked away in horror. It’s about the most impressive fall I’ve seen. Jockey Lewis Ferguson, 18, who survived a spectacular fall from Merrion Square shows off the cut on his nose . Ferguson, whose double somersault horror fall has been watched by hundreds of thousands online . The 18-year-old was mucking out the stables as usual at Paul Nicholls’ yard on Thursday morning . ‘There was nothing I could do to avoid it, you just have to let it take it’s course and hope it’s not a bad one. I’ve just got a cut on the nose so I’ve been very lucky. I got a bit of abuse from the lads and picked up a few hundred twitter followers but it’s all good banter. It won’t stop me getting back on a course. There’s been no special treatment. ‘My parents who live in the Scottish Borders were worried so I gave them a call so they knew I was ok. It’s not going to put me off riding at all I’d like to ride at the Cheltenham Festival and Aintree every year, that’s the ultimate aim. Bit disappointing because he was in front and maybe could have won. Jockey Ferguson hits the fence after his ride stumbles wildly on the approach to the fence at Wincanton . Colliding with the barrier forces the amateur jockey into a spectacular mid-air somersault . Wincanton clerk of the course Barry Johnson called it the worst fall he had ever seen. It was only Ferguson’s fifth race and the first time he had fallen although he has fallen a few times riding out. ‘Hopefully the next time I’m on the front page of the newspaper it will be for winning the Gold Cup or the Grand National. I gave the horse a little pat after, not a big one. Given the somersaults, maybe I’ll look at having a gymnastics career after finishing racing.’ Merrion Square was a hotly-tipped favourite to win the 4.20 at Wincanton on Wednesday until the fall . Ferguson escaped the fall and the only real pain was the cut on his nose and the banter from his friends .","Lewis Ferguson fell from Merrion Square at Wincanton on Wednesday .
Despite spectacular tumble he escaped with just a cut nose .
Ferguson has been mucking out stables as usual on Thursday morning .
The 18-year-old says incident that went viral was 'just a blur' to him .","There was no special treatment for Lewis Ferguson at Paul Nicholls’ yard on Thursday morning. The 18-year-old was mucking out the stables as usual, just a cut on the nose to show for the fall which has made him an internet sensation. Ferguson, whose double somersault horror fall from the favourite Merrion Square in the 4.20pm at Wincanton on Wednesday has been watched hundreds of thousands of times online. But he was back riding out and said he was undeterred from getting back in the sadal. ‘It was just a blur,’ he said, ‘I couldn’t work out what had happened until I got back to the weighing room and watched the replay. All the other jockeys asked me if I was alright and stuff, they all watched with me and looked away in horror. It’s about the most impressive fall I’ve seen. Jockey Lewis Ferguson, 18, who survived a spectacular fall from Merrion Square shows off the cut on his nose . Ferguson, whose double somersault horror fall has been watched by hundreds of thousands online . The 18-year-old was mucking out the stables as usual at Paul Nicholls’ yard on Thursday morning . ‘There was nothing I could do to avoid it, you just have to let it take it’s course and hope it’s not a bad one. I’ve just got a cut on the nose so I’ve been very lucky. I got a bit of abuse from the lads and picked up a few hundred twitter followers but it’s all good banter. It won’t stop me getting back on a course. There’s been no special treatment. ‘My parents who live in the Scottish Borders were worried so I gave them a call so they knew I was ok. It’s not going to put me off riding at all I’d like to ride at the Cheltenham Festival and Aintree every year, that’s the ultimate aim. Bit disappointing because he was in front and maybe could have won. Jockey Ferguson hits the fence after his ride stumbles wildly on the approach to the fence at Wincanton . Colliding with the barrier forces the amateur jockey into a spectacular mid-air somersault . Wincanton clerk of the course Barry Johnson called it the worst fall he had ever seen. It was only Ferguson’s fifth race and the first time he had fallen although he has fallen a few times riding out. ‘Hopefully the next time I’m on the front page of the newspaper it will be for winning the Gold Cup or the Grand National. I gave the horse a little pat after, not a big one. Given the somersaults, maybe I’ll look at having a gymnastics career after finishing racing.’ Merrion Square was a hotly-tipped favourite to win the 4.20 at Wincanton on Wednesday until the fall . Ferguson escaped the fall and the only real pain was the cut on his nose and the banter from his friends .","Lewis Ferguson, 18, was mucking out the stables as usual on Thursday morning. Ferguson's double somersault horror fall from the favourite Merrion Square in the 4.20pm at Wincanton on Wednesday has been watched hundreds of thousands of times online. Ferguson escaped the fall and the only real pain was the cut on his nose and the banter from his friends.","There was no special treatment for Lewis Ferguson at Paul Nicholls’ yard on Thursday morning. The 18-year-old was mucking out the stables as usual, just a cut on the nose to show for the fall which has made him an internet sensation. Ferguson, whose double somersault horror fall from the favourite Merrion Square in the 4.20pm at Wincanton on Wednesday has been watched hundreds of thousands of times online."
"When emergency crews received a call saying 'someone' had been knocked down by a car in Essex, they immediately sent two ambulances to the rescue. But the vehicles returned to base just moments later when the caller revealed the 'victim' was actually a squirrel that had been run over in Epping Forest. The report forms just part of a long list released by East of England ambulance service detailing their most bizarre, and irritating, call outs. Two ambulances were sent to Epping Forest after a caller told crews 'someone' had been run down, only for the 'victim' to turn out to be a squirrel. Another man said he had dropped his burger and it was 'bleeding' Another came from reveller in Basildon, Essex, who said 'I've dropped my burger and it is bleeding', while a third woman in Chelmsford, dialled 999 to report 'I've eaten too much takeaway food.' The service said it receives around 2,500 calls per day, and in the last two years has had to deal with 1,248 that did not need emergency help. Front-line crews have attended almost half of the phoney calls, believing them to be genuine emergencies. Also on the list is a woman from  Shoeburyness who called to say she was locked out of the house, while a man in Peterborough called to say his feet hurt after wearing shoes that were too small. In Hitchin, Hertfordshire, a man told 999 staff: 'I have been dieting and feel lethargic.' Gary Morgan, Regional Head of Emergency Operations Centres, asked people to use common-sense when calling, adding that misguided or hoax calls could cost lives. East on England ambulance revealed the bizarre calls as part of a list of 1,248 inappropriate call outs, saying that crew attended half of them, potentially putting lives at risk (file image) He said: 'We're an emergency service and our front-line staff are trained to save lives. 'However, sadly, some of the calls we receive are not even medically related and we will refer hoax calls to the police. 'We prioritise all life-threatening calls to get the quickest possible response. 'However, that response can be affected if our call handlers and front-line staff are dealing with inappropriate 999 calls. 'We would strongly urge people who think it is funny to make a prank call to stop and think about the potential consequences.' In another strange call one woman phoned to say she felt ill after eating too much takeaway, while a man reported that his feet were hurting after wearing shoes that were too tight .","Woman reported 'someone' had been run over, but victim was a squirrel .
Another man dialled 999 to say he dropped a burger which was 'bleeding'
East of England ambulance service warned hoax calls can cost lives .","When emergency crews received a call saying 'someone' had been knocked down by a car in Essex, they immediately sent two ambulances to the rescue. But the vehicles returned to base just moments later when the caller revealed the 'victim' was actually a squirrel that had been run over in Epping Forest. The report forms just part of a long list released by East of England ambulance service detailing their most bizarre, and irritating, call outs. Two ambulances were sent to Epping Forest after a caller told crews 'someone' had been run down, only for the 'victim' to turn out to be a squirrel. Another man said he had dropped his burger and it was 'bleeding' Another came from reveller in Basildon, Essex, who said 'I've dropped my burger and it is bleeding', while a third woman in Chelmsford, dialled 999 to report 'I've eaten too much takeaway food.' The service said it receives around 2,500 calls per day, and in the last two years has had to deal with 1,248 that did not need emergency help. Front-line crews have attended almost half of the phoney calls, believing them to be genuine emergencies. Also on the list is a woman from  Shoeburyness who called to say she was locked out of the house, while a man in Peterborough called to say his feet hurt after wearing shoes that were too small. In Hitchin, Hertfordshire, a man told 999 staff: 'I have been dieting and feel lethargic.' Gary Morgan, Regional Head of Emergency Operations Centres, asked people to use common-sense when calling, adding that misguided or hoax calls could cost lives. East on England ambulance revealed the bizarre calls as part of a list of 1,248 inappropriate call outs, saying that crew attended half of them, potentially putting lives at risk (file image) He said: 'We're an emergency service and our front-line staff are trained to save lives. 'However, sadly, some of the calls we receive are not even medically related and we will refer hoax calls to the police. 'We prioritise all life-threatening calls to get the quickest possible response. 'However, that response can be affected if our call handlers and front-line staff are dealing with inappropriate 999 calls. 'We would strongly urge people who think it is funny to make a prank call to stop and think about the potential consequences.' In another strange call one woman phoned to say she felt ill after eating too much takeaway, while a man reported that his feet were hurting after wearing shoes that were too tight .","Two ambulances were sent to Epping Forest after call about a 'victim' But the 'victims' turned out to be a squirrel that had been run over by a car. East of England ambulance service released a list of 1,248 'inappropriate' calls. Front-line crews have attended half of the phoney calls, believing them to be genuine emergencies.","When emergency crews received a call saying 'someone' had been knocked down by a car in Essex, they immediately sent two ambulances to the rescue. But the vehicles returned to base just moments later when the caller revealed the 'victim' was actually a squirrel that had been run over in Epping Forest. The report forms just part of a long list released by East of England ambulance service detailing their most bizarre, and irritating, call outs."
