text,summary,text_trunc,abs_summary,ext_summary
"Time fries when you're having fun. Dedicated waitress Judy Eddingfield, 65, celebrated her 50th anniversary working at Winstead's restaurant in Kansas City last week and declares that it's the only job's she's ever had or ever wanted. 'It's like my home away from home and I just love it here,' Eddingfield told Fox. Scroll down for video . Dedicated employee: For most of her life Judy Eddingfield has been employed as a server at Winstead's in Kansas City and says it's the only job she's ever had or ever wanted . Is that you? A staff member at Winstead's said she believes one of the women in this photograph is Judy when she first started working at the restaurant . Classic establishment:  This is a photo of the The Winstead family who own the restaurant showing up for work in 1940 around the time when Judy Eddingfield's mother started working there . Eddingfield says she remembers when French fries and a classic Coca-Cola cost just 65 cents at the same restaurant she's worked at for half-a-century. For Eddingfield, slinging burgers with a smile is a family tradition. On April, 6, 1965 Eddinngfield began working at the restaurant where she was trained by her mother who had already been employed at the establishment for 13 years. Eddingfield said that her first day on the job when she was just 15-years-old she spilled a shake all over a woman's fur coat and thought for sure that she'd be fired. 'The tray tipped over and vanilla malt slid down a lady’s fur coat. I was so embarrassed,' Eddingfield told the Kansas City Star 'Of course, she hollered,' said Eddingfield. All was forgiven after Winstead's, open since 1940, got the coat cleaned. Eddingfield along with many of her siblings continued to provide top notch service. Loves to serve: Judy Eddingfield says that her kind customers are what make her job worthwhile . Lots of love: Winstead's honored Judy Eddingfield last week for her wonderful 50 years of working at the classic burger restaurant . 'I had two brothers, my sister, my mother, two aunts, two cousins and lots of friends that have worked here,' said Eddingfield. 'I was three years old when my mother started here, so I've been eating these burger 60 some years.' Eddingfield says she even met her first husband outside the restaurant and they married 18 months later. The Kansas City Star reports that one of Eddingfield's favorite Winstead’s memories was when Jerry Mathers and Tony Dow of the television series 'Leave It to Beaver' came to eat there in the late 1970's. She said that Mathers was 'talking with his hands' and knocked sent his food flying everywhere. Marriage: Judy Eddingfield even met her true love who she calls 'Frog' at Winstead's and the pair married 18-months-later . Celebration: Dedicated waitress Judy Eddingfield celebrated her 50th anniversary working at Winstead's restaurant in Kansas City last week and declares that it's the only job's she's ever had or ever wanted . 'Leave it to Beaver,' his on-screen brother said jokingly, almost as though it were scripted. On a scarier note, Eddingfield says she once was closing up the restaurant when a man started knocking on the door with a gun. She called 911 and hid in the bathroom until the police arrived. Eddingfield's employees say that as she gets older Eddingfield gets more delightful and that she is always willing to share her knowledge of the business. 'She trained me to be her. Pleasant as she is, prompt. So that people will come here for you and continue to come,' said server Sue Allen who has been there for 13 years. Close knit team: Eddingfield, pictured with some of her coworkers, has a passion for serving food . Nothing's changed!: Winstead's when it first opened in 1940 has an almost identical style to the Winstead's that's here today . Eddingfield's biggest tip she ever received was a generous man who treated his entire staff in 2014 and staff agree it was well deserved. Eddigfield turns 66 on May 13 and though she is getting older, she plans to keep on working as long as she is healthy. When asked why she chose to stay at the establishment for so long, she replied that the customers make her job worthwhile. 'The customers really make it special,' she says. General manager Kathi Fern says that Eddingfield is one of her best employees. 'It's just amazing the way she treats her customers,' said Fern. 'I call her my dinosaur. She's a dying breed and there will never be servers like her again.' said Fern of her dedicated employee. Classic drive-thru: Winstead's was established in 1940 and to this day is known for serving quality burgers at their drive-thru .","'It's like my home away from home and I just love it here,' Judy Eddingfield said of Winstead's in Kansas City .
Judy Eddingfield celebrated her 50th anniversary working at Winstead's restaurant last week where she began working when she was 15 in 1965 .
Eddinfield's mother along with her siblings all worked at the restaurant .","Time fries when you're having fun. Dedicated waitress Judy Eddingfield, 65, celebrated her 50th anniversary working at Winstead's restaurant in Kansas City last week and declares that it's the only job's she's ever had or ever wanted. 'It's like my home away from home and I just love it here,' Eddingfield told Fox. Scroll down for video . Dedicated employee: For most of her life Judy Eddingfield has been employed as a server at Winstead's in Kansas City and says it's the only job she's ever had or ever wanted . Is that you? A staff member at Winstead's said she believes one of the women in this photograph is Judy when she first started working at the restaurant . Classic establishment:  This is a photo of the The Winstead family who own the restaurant showing up for work in 1940 around the time when Judy Eddingfield's mother started working there . Eddingfield says she remembers when French fries and a classic Coca-Cola cost just 65 cents at the same restaurant she's worked at for half-a-century. For Eddingfield, slinging burgers with a smile is a family tradition. On April, 6, 1965 Eddinngfield began working at the restaurant where she was trained by her mother who had already been employed at the establishment for 13 years. Eddingfield said that her first day on the job when she was just 15-years-old she spilled a shake all over a woman's fur coat and thought for sure that she'd be fired. 'The tray tipped over and vanilla malt slid down a lady’s fur coat. I was so embarrassed,' Eddingfield told the Kansas City Star 'Of course, she hollered,' said Eddingfield. All was forgiven after Winstead's, open since 1940, got the coat cleaned. Eddingfield along with many of her siblings continued to provide top notch service. Loves to serve: Judy Eddingfield says that her kind customers are what make her job worthwhile . Lots of love: Winstead's honored Judy Eddingfield last week for her wonderful 50 years of working at the classic burger restaurant . 'I had two brothers, my sister, my mother, two aunts, two cousins and lots of friends that have worked here,' said Eddingfield. 'I was three years old when my mother started here, so I've been eating these burger 60 some years.' Eddingfield says she even met her first husband outside the restaurant and they married 18 months later. The Kansas City Star reports that one of Eddingfield's favorite Winstead’s memories was when Jerry Mathers and Tony Dow of the television series 'Leave It to Beaver' came to eat there in the late 1970's. She said that Mathers was 'talking with his hands' and knocked sent his food flying everywhere. Marriage: Judy Eddingfield even met her true love who she calls 'Frog' at Winstead's and the pair married 18-months-later . Celebration: Dedicated waitress Judy Eddingfield celebrated her 50th anniversary working at Winstead's restaurant in Kansas City last week and declares that it's the only job's she's ever had or ever wanted . 'Leave it to Beaver,' his on-screen brother said jokingly, almost as though it were scripted. On a scarier note, Eddingfield says she once was closing up the restaurant when a man started knocking on the door with a gun. She called 911 and hid in the bathroom until the police arrived. Eddingfield's employees say that as she gets older Eddingfield gets more delightful and that she is always willing to share her knowledge of the business. 'She trained me to be her. Pleasant as she is, prompt. So that people will come here for you and continue to come,' said server Sue Allen who has been there for 13 years. Close knit team: Eddingfield, pictured with some of her coworkers, has a passion for serving food . Nothing's changed!: Winstead's when it first opened in 1940 has an almost identical style to the Winstead's that's here today . Eddingfield's biggest tip she ever received was a generous man who treated his entire staff in 2014 and staff agree it was well deserved. Eddigfield turns 66 on May 13 and though she is getting older, she plans to keep on working as long as she is healthy. When asked why she chose to stay at the establishment for so long, she replied that the customers make her job worthwhile. 'The customers really make it special,' she says. General manager Kathi Fern says that Eddingfield is one of her best employees. 'It's just amazing the way she treats her customers,' said Fern. 'I call her my dinosaur. She's a dying breed and there will never be servers like her again.' said Fern of her dedicated employee. Classic driv","Judy Eddingfield, 65, celebrated her 50th anniversary working at Winstead's restaurant in Kansas City last week. 'It's like my home away from home and I just love it here,' said Eddingfields. Edding's first day on the job when she was just 15-years-old she spilled a shake all over a woman's fur coat and thought for sure that she'd be fired. She once was closing up the restaurant when a man started knocking on the door with a gun.","Time fries when you're having fun. Dedicated waitress Judy Eddingfield, 65, celebrated her 50th anniversary working at Winstead's restaurant in Kansas City last week and declares that it's the only job's she's ever had or ever wanted. 'It's like my home away from home and I just love it here,' Eddingfield told Fox."
"Microsoft has a new pilot program to hire people with autism for full-time positions within the company. The announcement was made on the company's blog by Microsoft Corporate VP of Worldwide Operations, Mary Ellen Smith, who has a teenage son, Shawn, with autism. The positions will be based at its Redmond campus in Washington and the program will be run in partnership with Specialisterne, a Danish nonprofit that helps train people with autism for careers in IT. Smith wrote on the blog: 'It's simple, Microsoft is stronger when we expand opportunity and we have a diverse workforce that represents our customers.' The announcement was made on the company's blog by Microsoft Corporate VP of Worldwide Operations, Mary Ellen Smith, who has a teenage son, Shawn, with autism . 'The day my son was diagnosed I distinctly remember the final words of two doctors I overheard as my husband and I left the medical center, ""I think they understand."" 'I also remember how we walked to the car, pulled onto the road, drove 15 miles to our home, and entered the house. All in silence. We did not know what to say. 'But we do now. What we learned over the last 15 years was to find our voice. To model what a unique advantage a young man like my son Shawn can offer. 'To think of where he is now, a college freshman and part-time employee, and where he has the potential to go, makes my husband and I so proud. The positions will be based at its Redmond campus in Washington and the program will be run in partnership with Specialisterne, a Danish nonprofit that helps train people with autism for careers in IT . She added: 'I am also proud of how our society and our workplace is moving forward with the commitment to help support people with autism and disabilities in general.' Last year Microsoft CEO Satya Nadella was forced to apologize for saying that women don't need to ask for a raise and should just trust the system to pay them well. Nadella was blasted on Twitter and in blog posts for his comments, which were made at an event for women in computing. He had been asked to give his advice to women who are uncomfortable requesting a raise. His response: 'It's not really about asking for the raise, but knowing and having faith that the system will actually give you the right raises as you go along.' Microsoft is now focusing on diversity. Last year Microsoft CEO Satya Nadella (pictured) was forced to apologize for saying that women don't need to ask for a raise and should just trust the system to pay them well . Not asking for raise, he added, is 'good karma' that would help a boss realize that the employee could be trusted and should have more responsibility. Still, his comments at the event, the Grace Hopper Celebration of Women in Computing, underscored why many see technology companies as workplaces that are difficult to navigate or even unfriendly for women and minorities. Tech companies, particularly the engineering ranks, are overwhelmingly male, white and Asian. Criticized for their lack of diversity, major companies say they are trying to address the problem with programs such as employee training sessions and by participating in initiatives meant to introduce girls to coding. Twenty-nine percent of Microsoft's employees are women, according to figures the company released last year. Its technical and engineering staff and its management are just 17 percent female. That's roughly comparable to diversity data released by other big tech companies last year. Commenting on Microsoft's decision Sarah Lambert, Head of Policy at the National Autistic Society, told Daily Mail Online: 'It's encouraging to see a global company like Microsoft recognise the untapped potential of adults with autism and we hope that other organisations follow their lead. 'Autism is a spectrum condition and many people may have strengths such as accuracy, a good eye for detail and reliability, which can benefit all sorts of businesses, not just the technology industry.'","Microsoft Corporate VP of Worldwide Operations, Mary Ellen Smith, who has a teenage son Shawn with autism, made the announcement .
Program will be run in partnership with Specialisterne, a Danish nonprofit that helps train people with autism for careers in IT .
Full-time positions based at its Redmond campus, Washington .","Microsoft has a new pilot program to hire people with autism for full-time positions within the company. The announcement was made on the company's blog by Microsoft Corporate VP of Worldwide Operations, Mary Ellen Smith, who has a teenage son, Shawn, with autism. The positions will be based at its Redmond campus in Washington and the program will be run in partnership with Specialisterne, a Danish nonprofit that helps train people with autism for careers in IT. Smith wrote on the blog: 'It's simple, Microsoft is stronger when we expand opportunity and we have a diverse workforce that represents our customers.' The announcement was made on the company's blog by Microsoft Corporate VP of Worldwide Operations, Mary Ellen Smith, who has a teenage son, Shawn, with autism . 'The day my son was diagnosed I distinctly remember the final words of two doctors I overheard as my husband and I left the medical center, ""I think they understand."" 'I also remember how we walked to the car, pulled onto the road, drove 15 miles to our home, and entered the house. All in silence. We did not know what to say. 'But we do now. What we learned over the last 15 years was to find our voice. To model what a unique advantage a young man like my son Shawn can offer. 'To think of where he is now, a college freshman and part-time employee, and where he has the potential to go, makes my husband and I so proud. The positions will be based at its Redmond campus in Washington and the program will be run in partnership with Specialisterne, a Danish nonprofit that helps train people with autism for careers in IT . She added: 'I am also proud of how our society and our workplace is moving forward with the commitment to help support people with autism and disabilities in general.' Last year Microsoft CEO Satya Nadella was forced to apologize for saying that women don't need to ask for a raise and should just trust the system to pay them well. Nadella was blasted on Twitter and in blog posts for his comments, which were made at an event for women in computing. He had been asked to give his advice to women who are uncomfortable requesting a raise. His response: 'It's not really about asking for the raise, but knowing and having faith that the system will actually give you the right raises as you go along.' Microsoft is now focusing on diversity. Last year Microsoft CEO Satya Nadella (pictured) was forced to apologize for saying that women don't need to ask for a raise and should just trust the system to pay them well . Not asking for raise, he added, is 'good karma' that would help a boss realize that the employee could be trusted and should have more responsibility. Still, his comments at the event, the Grace Hopper Celebration of Women in Computing, underscored why many see technology companies as workplaces that are difficult to navigate or even unfriendly for women and minorities. Tech companies, particularly the engineering ranks, are overwhelmingly male, white and Asian. Criticized for their lack of diversity, major companies say they are trying to address the problem with programs such as employee training sessions and by participating in initiatives meant to introduce girls to coding. Twenty-nine percent of Microsoft's employees are women, according to figures the company released last year. Its technical and engineering staff and its management are just 17 percent female. That's roughly comparable to diversity data released by other big tech companies last year. Commenting on Microsoft's decision Sarah Lambert, Head of Policy at the National Autistic Society, told Daily Mail Online: 'It's encouraging to see a global company like Microsoft recognise the untapped potential of adults with autism and we hope that other organisations follow their lead. 'Autism is a spectrum condition and many people may have strengths such as accuracy, a good eye for detail and reliability, which can benefit all sorts of businesses, not just the technology industry.'","The positions will be based at its Redmond campus in Washington. The program will be run in partnership with Specialisterne, a Danish nonprofit that helps train people with autism for careers in IT. The announcement was made on the company's blog by Microsoft Corporate VP of Worldwide Operations, Mary Ellen Smith. Smith has a teenage son, Shawn, with autism.","Microsoft has a new pilot program to hire people with autism for full-time positions within the company. The announcement was made on the company's blog by Microsoft Corporate VP of Worldwide Operations, Mary Ellen Smith, who has a teenage son, Shawn, with autism. The positions will be based at its Redmond campus in Washington and the program will be run in partnership with Specialisterne, a Danish nonprofit that helps train people with autism for careers in IT."
